{
  "schema_version": 1,
  "execution_id": "00000000-0000-4000-8000-000000000009",
  "intent_id": "intent:proposal-0001",
  "status": "succeeded",
  "observation": { "category": "SUCCESS" },
  "evidence": [
    { "kind": "dagster_run", "uri": "dagster://runs/00000000-0000-4000-8000-000000000009" }
  ],
  "started_at": "2026-10-01T00:00:00Z",
  "finished_at": "2026-10-01T00:00:03Z"
}
